{
  "$schema": "../schemas/registry-health.schema.json",
  "category_counts": {
    "admin": 4,
    "containers": 3,
    "data": 13,
    "debugging": 18,
    "education": 2,
    "gpu": 10,
    "interactive": 7,
    "mpi": 12,
    "performance": 13,
    "scheduler": 54,
    "software": 21,
    "workflow": 10
  },
  "collection_count": 12,
  "collection_coverage": [
    {
      "id": "ai-hpc",
      "skill_count": 15,
      "skill_ids": [
        "gpu-sanity-check",
        "ray-on-slurm",
        "dask-jobqueue-on-slurm",
        "jax-distributed-on-slurm",
        "pytorch-ddp-on-slurm",
        "deepspeed-on-slurm",
        "nccl-diagnostics",
        "gpu-memory-triage",
        "tensorboard-on-slurm",
        "streamlit-on-slurm",
        "apptainer-run-container",
        "dataset-staging-to-scratch",
        "checkpoint-restart-workflow",
        "reproducible-run-capture",
        "slurm-efficiency-report"
      ]
    },
    {
      "id": "bioinformatics-workflows",
      "skill_count": 7,
      "skill_ids": [
        "nf-core-on-slurm",
        "gatk-workflow-on-hpc",
        "blast-on-slurm",
        "nextflow-on-slurm",
        "snakemake-on-slurm",
        "dataset-staging-to-scratch",
        "checksum-manifest-create"
      ]
    },
    {
      "id": "containers",
      "skill_count": 7,
      "skill_ids": [
        "container-build-for-hpc",
        "apptainer-run-container",
        "apptainer-mpi-on-slurm",
        "gpu-sanity-check",
        "dataset-staging-to-scratch",
        "checksum-manifest-create",
        "reproducible-run-capture"
      ]
    },
    {
      "id": "core-hpc",
      "skill_count": 16,
      "skill_ids": [
        "slurm-submit-job",
        "slurm-job-array-patterns",
        "slurm-job-dependency-chain",
        "slurm-pending-reason-triage",
        "slurm-monitor-job",
        "slurm-resource-estimator",
        "slurm-efficiency-report",
        "checkpoint-restart-workflow",
        "job-failure-triage",
        "interactive-session",
        "jupyter-on-slurm",
        "rstudio-on-slurm",
        "vscode-tunnel-on-slurm",
        "openmp-thread-affinity",
        "quota-and-filesystem-triage",
        "scratch-storage-management"
      ]
    },
    {
      "id": "data-movement",
      "skill_count": 8,
      "skill_ids": [
        "globus-transfer-dataset",
        "rsync-data-transfer",
        "checksum-manifest-create",
        "dataset-staging-to-scratch",
        "ior-mdtest-storage-smoke",
        "large-file-archive-prepare",
        "scratch-storage-management",
        "quota-and-filesystem-triage"
      ]
    },
    {
      "id": "facility-ops",
      "skill_count": 4,
      "skill_ids": [
        "cluster-usage-report-readonly",
        "slurm-pending-reason-triage",
        "node-health-readonly-triage",
        "module-tree-health-check"
      ]
    },
    {
      "id": "gpu-mpi-performance",
      "skill_count": 16,
      "skill_ids": [
        "mpi-hello-and-benchmark",
        "compiler-mpi-matrix",
        "mpi4py-on-slurm",
        "apptainer-mpi-on-slurm",
        "gpu-sanity-check",
        "ray-on-slurm",
        "jax-distributed-on-slurm",
        "pytorch-ddp-on-slurm",
        "nccl-diagnostics",
        "gpu-memory-triage",
        "tensorboard-on-slurm",
        "deepspeed-on-slurm",
        "openmp-thread-affinity",
        "slurm-efficiency-report",
        "ior-mdtest-storage-smoke",
        "performance-profile-basic"
      ]
    },
    {
      "id": "scheduler-basics",
      "skill_count": 7,
      "skill_ids": [
        "slurm-submit-job",
        "pbs-submit-job",
        "lsf-submit-job",
        "htcondor-submit-job",
        "grid-engine-submit-job",
        "job-failure-triage",
        "reproducible-run-capture"
      ]
    },
    {
      "id": "simulation-workflows",
      "skill_count": 13,
      "skill_ids": [
        "gromacs-on-slurm",
        "lammps-on-slurm",
        "namd-on-slurm",
        "quantum-espresso-on-slurm",
        "cp2k-on-slurm",
        "openfoam-on-slurm",
        "wrf-on-slurm",
        "mpi-hello-and-benchmark",
        "openmp-thread-affinity",
        "ior-mdtest-storage-smoke",
        "performance-profile-basic",
        "reproducible-run-capture",
        "checkpoint-restart-workflow"
      ]
    },
    {
      "id": "software-stacks",
      "skill_count": 23,
      "skill_ids": [
        "module-environment-debug",
        "module-tree-health-check",
        "compiler-mpi-matrix",
        "reproducible-run-capture",
        "python-virtualenv-on-hpc",
        "open-ondemand-batch-connect",
        "tensorboard-on-slurm",
        "streamlit-on-slurm",
        "ray-on-slurm",
        "dask-jobqueue-on-slurm",
        "jax-distributed-on-slurm",
        "mpi4py-on-slurm",
        "rscript-on-slurm",
        "rstudio-on-slurm",
        "julia-on-slurm",
        "matlab-batch-on-slurm",
        "vscode-tunnel-on-slurm",
        "conda-mamba-on-hpc",
        "container-build-for-hpc",
        "apptainer-run-container",
        "apptainer-mpi-on-slurm",
        "spack-environment-create",
        "easybuild-install-software"
      ]
    },
    {
      "id": "training-onboarding",
      "skill_count": 17,
      "skill_ids": [
        "training-cluster-reset-checklist",
        "slurm-submit-job",
        "interactive-session",
        "open-ondemand-batch-connect",
        "jupyter-on-slurm",
        "rstudio-on-slurm",
        "vscode-tunnel-on-slurm",
        "python-virtualenv-on-hpc",
        "tensorboard-on-slurm",
        "streamlit-on-slurm",
        "rscript-on-slurm",
        "julia-on-slurm",
        "matlab-batch-on-slurm",
        "conda-mamba-on-hpc",
        "module-environment-debug",
        "dataset-staging-to-scratch",
        "job-failure-triage"
      ]
    },
    {
      "id": "workflow-engines",
      "skill_count": 7,
      "skill_ids": [
        "slurm-job-dependency-chain",
        "cwl-on-slurm",
        "wdl-on-slurm",
        "dask-jobqueue-on-slurm",
        "nextflow-on-slurm",
        "snakemake-on-slurm",
        "nf-core-on-slurm"
      ]
    }
  ],
  "generated_by": "tools/build_health.py",
  "maturity_counts": {
    "seed": 71
  },
  "risk_by_skill": {
    "apptainer-mpi-on-slurm": "medium",
    "apptainer-run-container": "medium",
    "blast-on-slurm": "medium",
    "checkpoint-restart-workflow": "medium",
    "checksum-manifest-create": "low",
    "cluster-usage-report-readonly": "low",
    "compiler-mpi-matrix": "low",
    "conda-mamba-on-hpc": "medium",
    "container-build-for-hpc": "medium",
    "cp2k-on-slurm": "medium",
    "cwl-on-slurm": "medium",
    "dask-jobqueue-on-slurm": "medium",
    "dataset-staging-to-scratch": "medium",
    "deepspeed-on-slurm": "medium",
    "easybuild-install-software": "medium",
    "gatk-workflow-on-hpc": "medium",
    "globus-transfer-dataset": "medium",
    "gpu-memory-triage": "low",
    "gpu-sanity-check": "medium",
    "grid-engine-submit-job": "medium",
    "gromacs-on-slurm": "medium",
    "htcondor-submit-job": "medium",
    "interactive-session": "medium",
    "ior-mdtest-storage-smoke": "medium",
    "jax-distributed-on-slurm": "medium",
    "job-failure-triage": "low",
    "julia-on-slurm": "medium",
    "jupyter-on-slurm": "medium",
    "lammps-on-slurm": "medium",
    "large-file-archive-prepare": "medium",
    "lsf-submit-job": "medium",
    "matlab-batch-on-slurm": "medium",
    "module-environment-debug": "low",
    "module-tree-health-check": "low",
    "mpi-hello-and-benchmark": "medium",
    "mpi4py-on-slurm": "medium",
    "namd-on-slurm": "medium",
    "nccl-diagnostics": "medium",
    "nextflow-on-slurm": "medium",
    "nf-core-on-slurm": "medium",
    "node-health-readonly-triage": "low",
    "open-ondemand-batch-connect": "medium",
    "openfoam-on-slurm": "medium",
    "openmp-thread-affinity": "medium",
    "pbs-submit-job": "medium",
    "performance-profile-basic": "low",
    "python-virtualenv-on-hpc": "low",
    "pytorch-ddp-on-slurm": "medium",
    "quantum-espresso-on-slurm": "medium",
    "quota-and-filesystem-triage": "low",
    "ray-on-slurm": "medium",
    "reproducible-run-capture": "low",
    "rscript-on-slurm": "medium",
    "rstudio-on-slurm": "medium",
    "rsync-data-transfer": "medium",
    "scratch-storage-management": "low",
    "slurm-efficiency-report": "low",
    "slurm-job-array-patterns": "medium",
    "slurm-job-dependency-chain": "medium",
    "slurm-monitor-job": "low",
    "slurm-pending-reason-triage": "low",
    "slurm-resource-estimator": "low",
    "slurm-submit-job": "medium",
    "snakemake-on-slurm": "medium",
    "spack-environment-create": "medium",
    "streamlit-on-slurm": "medium",
    "tensorboard-on-slurm": "medium",
    "training-cluster-reset-checklist": "medium",
    "vscode-tunnel-on-slurm": "medium",
    "wdl-on-slurm": "medium",
    "wrf-on-slurm": "medium"
  },
  "risk_counts": {
    "low": 17,
    "medium": 54
  },
  "schema_version": "0.1.0",
  "site_adapter_count": 2,
  "skill_count": 71,
  "status_counts": {
    "draft": 71
  },
  "uncollected_skill_ids": []
}
